,subreddit,selftext,title
0,AnimalCrossing,,The Legend of Coco: Twilight Princess
1,AnimalCrossing,,Star Trail &amp; Time-Lapse - ACNH-01 (Youtube: https://youtu.be/8v8l2KX8q84)
2,AnimalCrossing,i have a genuine robust statue i got from redd from harveys island and i cant donate it to blathers? i havent donated any art before so im not sure what to do :V,why cant i donate art to blathers?
3,AnimalCrossing,,Star Trail &amp; Time-Lapse - ACNH-01 (Youtube: https://youtu.be/8v8l2KX8q84)
4,AnimalCrossing,"Hi all, hoping something like this exists, but basically I’m looking for a complete list of acnh items, where I can do things like see just items that are a specific size. I’ve googled but came up short. Does anyone here know of a resource like this?",Help finding complete sortable items list
5,AnimalCrossing,,[Help] I don’t want them.
6,AnimalCrossing,,Daisy Mae at Brewster’s is the cutest!!
7,AnimalCrossing,,And I would've gotten away with it too...
8,AnimalCrossing,,"Simon wanted a cool car lot, so I tried my best to give him a car show room ✨"
9,AnimalCrossing,Looking for black or brown simple panel.,Looking for
10,AnimalCrossing,,"The short panels are game changing, no more using random objects to hide the repeating pattern!"
11,AnimalCrossing,,"Made herringbone designs. If anyone else would like to use them, my code is MA-9511-4818-7469"
12,AnimalCrossing,In need of peaches and apples is the only way to get them going to friends islands or can I get them from nook tickets even if my native fruit is pears and oranges thanks,Fruit
13,AnimalCrossing,,I wish I could make rooms just a little bigger so I could actually decorate the outdoor walkway of this cafe 😩
14,AnimalCrossing,,"I drew a giant Cock to greet new arrivals, it’s Ken"
15,AnimalCrossing,,[OC] Harriet gave my character a new haircut and I might be in love with it :')
16,AnimalCrossing,,Lazy Sunday Afternoon 🍂🤎
17,AnimalCrossing,Where are daisy mae’s parents? i understand that daisy mae is taking over for her grandmother for the turnip sales but i see no mention of her mother and father anywhere is there just no answer? did they die like the able sisters parents did? if so why is there no mention of that either?,Daisy mae’s parents
18,AnimalCrossing,,I'm working on recreating Timber train station from Final Fantasy 8 and having such fun!
19,AnimalCrossing,"So I’ve given gyroids to three villagers so far and for some reason they’re all placed facing the back wall of the villager homes! Is this happening to anyone else?

Also, low key have this conspiracy  theory that &gt;!This is a sneaky way to make people buy the DLC so we can remodel villager homes to fix this!&lt; &gt;.&gt;",Whyyyyy?!
20,AnimalCrossing,[removed],Recovering island from a damaged Switch?
21,AnimalCrossing,,"The new camera mode, filter and items are so heavenly with cottagecore themes! It gives me somewhat Ghibli vibes"
22,AnimalCrossing,[removed],How do I get pigeon milk with my coffee?
23,AnimalCrossing,[removed],Question: Can you get Gyroids on a Nook Miles Ticket Island?
24,AnimalCrossing,,"Tread lightly.... You never know what may be underfoot (Eyehole pattern by me, MA in comments)"
25,AnimalCrossing,"Before Daisy Mae would hang out until you logged off, one time I even kept the game open so Daisy Mae could watch the fireworks lol. Anyway, today I nearly forgot about turnips and logged on a couple minutes before noon. I bought a couple turnips but had to run to the bank to get more bells and now I can’t find her anywhere.",Does Daisy Mae disappear right at noon now?
26,AnimalCrossing,[removed],Anyone have their villager in boxes they don’t want to go into the void? I have a space and no nook miles/ tickets to go looking lawll x
27,AnimalCrossing,"My bf started playing again yesterday and I showed him all the new features. But somehow the DIY recipes+ is not available for him at the atm. Is this feature locked behind some sort of barrier? He didn't play for nearly a year and reached three stars yesterday. 

I unlocked everything as soon as possible so I don't know what I did.",DIY recipes+ not available
28,AnimalCrossing,,My reading nook
29,AnimalCrossing,,I kicked ozzie off my island as i was villager hunting HE SHOWS UP ON ONE OF THE ISLANDS!
30,AnimalCrossing,"When does the merchandise on harvs Island rotate? It's been over a week and it's all the same wallpaper, seeds and even art. I check it everyday and their all selling the same exact stuff. I thought I would get new things today (Sunday) but no such luck.",Harvs Island?
31,AnimalCrossing,,Phyllis brings Pelly &amp; Pete with her to the Roost!
32,AnimalCrossing,,Sorry Jack. It's ghoul's night
33,AnimalCrossing,,I finished my Restaurant at 5am and it forced Tia to come to work asleep and if that ain't the most relatable thing ever 😴
34,AnimalCrossing,,I recreated the New Leaf Roost in HHP! :D
35,AnimalCrossing,,"Just two travel influencers in a rural town, reviewing the food and the sights"
36,AnimalCrossing,,WIP! Something I'm working on to add some lore to the gnome theme I have going on with my island
37,AnimalCrossing,"I bought redds shop in harvs island but every time he’s there, he only has the same statue and painting, both are fake. I don’t want to buy them, do I have to buy them to cycle a new painting until a real one comes?",How come Redd only ever has the same 2 paintings every time at Harv’s island?
38,AnimalCrossing,,I found Daisy Mae in the Roost and I am freaking out she is so cute!!!
39,AnimalCrossing,,What do you think about my new soap dispenser and espresso pot?
40,AnimalCrossing,Maybe I'll do the Wild World Roost next?,I recreated the New Leaf Roost for the cafe in HHP :D
41,AnimalCrossing,,Garden is done!
42,AnimalCrossing,,Nan's Hotel Room
43,AnimalCrossing,,Can’t wait for my Roses to grow !
44,AnimalCrossing,,I was looking for Ketchup. Got Sasha instead. Just 3 tickets in!!! 🥳 Take that Nookazon!
45,AnimalCrossing,,In the end Victor Perkins is our savior (Vector)
46,AnimalCrossing,,I just found Lily while island hopping and had to get her the froggy chair 🥰 perfection
47,AnimalCrossing,,"Pietro’s yard just got a very chaotic, whimsical update."
48,AnimalCrossing,,Look At The Bottom Left Corner
49,AnimalCrossing,"&amp;#x200B;

[i finally got her picture after spending around 15000+ bells on her next is flurry](https://preview.redd.it/11st7omjylz71.jpg?width=536&amp;format=pjpg&amp;auto=webp&amp;s=2fc99fed9ceabc7f3be744b59c5e09134c7729f2)",i got her pictureeeee
50,AnimalCrossing,,"Phyllis, Pelly &amp; Pete at the Roost"
51,AnimalCrossing,,Look At Bottom Left Corner
52,AnimalCrossing,[removed],Does anyone have any NMT to sell for bells?
53,AnimalCrossing,[removed],Helppppp
54,AnimalCrossing,,Rate my villagers(please)
55,AnimalCrossing,,Don’t choose Flower Ordinance. 70% of my island is now covered by this plague
56,AnimalCrossing,,Shep's Sounds of the Streets Vibes
57,AnimalCrossing,,May I have your attention real quick? Look at Chabwick. He's adorable and reminds me of Pingu with headphones (TヮT)ﾟ
58,AnimalCrossing,,She is the devil
59,AnimalCrossing,,I recently got this item in the game and thought this was pretty neat.
60,AnimalCrossing,,Exactly 100 NMTs later
61,AnimalCrossing,,Phyllis brings Pelly &amp; Pete with her to the Roost!
62,AnimalCrossing,,I’m so happy with my villagers on my island 🥲
63,AnimalCrossing,So upon investigation neither Nooks Cranny nor Happy Home Paradise are restocking items. The last few days it has been the same items. I know cause I brought something from both and the sold out sign is in both shops. Don't know if it's a bug due to the new update to 2.0.1 because before this update I have had no issues with either shops. Nook Shopping changes items everyday so it's just Nooks Cranny and the Happy Home Paradise shops. I'm hoping there is a fix soon cause it would be nice to get fresh new items everyday,Quick question about Nooks Cranny and Happy Home Paradise
64,AnimalCrossing,,"My restaurant, The Blue Moon 🌙 ☁️"
65,AnimalCrossing,,Shep and Sylvana vibing ❣️
66,AnimalCrossing,,My recent Hexagon Road path now comes in Fall Shade!
67,AnimalCrossing,,You can buy your villagers furniture now??
68,AnimalCrossing,,Moment of zen
69,AnimalCrossing,,"I’m so happy we finally have Lottie in the game, so I decided to draw her as a real otter! [OC]"
70,AnimalCrossing,,"So excited! I just finished up Antonio’s yard, and I’m loving how it turned out :D"
71,AnimalCrossing,,Apollo's new interior :) I appreciate the option to customize our villager's exterior and interior so much!
72,AnimalCrossing,"Hi all, just after a little clarification. Myself and my partner are on the same family membership on 2 separate profiles on one device, she owns ACNH and is the owner of the island. Just wondering if the new DLC would work fine if I purchase the extension of the membership to gain access to the DLC? Hope that makes sense!",ACNH DLC question
73,AnimalCrossing,I’m going to restart my island completely over and I wanted to know if anybody would let me drop all of my items &amp; bells on their beach so I can still have something left from all the hard work that I did 😅😬,Need Help 😅
74,AnimalCrossing,,Where are Timmy and Tommy getting their merchandise
75,AnimalCrossing,,Bunnie's new interior on the island :)
76,AnimalCrossing,,"Brief tour of the private room in my medieval restaurant - ""Knights of Feast""!"
77,AnimalCrossing,,ava’s vacation home for cooking lessons
78,AnimalCrossing,,"When Pietro is HONK HONKing at my door, but I won't open"
79,AnimalCrossing,,sorry kidd
80,AnimalCrossing,,anime/manga inspired classroom
81,AnimalCrossing,,I gave Poppy a new interior on my island ♡
82,AnimalCrossing,,Noo!! Stitches!!
83,AnimalCrossing,,When a farmer starts playing ACNH
84,AnimalCrossing,[removed],Is buying Happy Home Paradise worth it?
85,AnimalCrossing,,I gave Poppy a new interior on my island ♡
86,AnimalCrossing,,Human…?
87,AnimalCrossing,"Does anyone know when the stock of the vendors at Harv's refreshes? I've had the shops open for over a week and thought they would refresh on Sundays, but everyone still has the same items. Thanks in advance!",Harv's Island refresh?
88,AnimalCrossing,,Change my mind
89,AnimalCrossing,,I trapped Eloise using a bunch of library walls in her vacation home but now she escaped and is banging on my door HELP
90,AnimalCrossing,,The Adventures of Tom Sawyer
91,AnimalCrossing,[removed],How do I go back and edit facilities?
92,AnimalCrossing,,"This guy right here will always and forever be my favorite villager, my first animal crossing game was wild world and Punchy was one of my starter villagers and he was the one who gave me a birthday cake on my birthday every year, I love this cat so much! I was so happy when we I got him back :)"
93,AnimalCrossing,,Made this today xD
94,AnimalCrossing,,I have a bed but I never sleep what am I? 🎄
95,AnimalCrossing,,The lighting option really helps you set the mood. (undersea room wip)
96,AnimalCrossing,,episode 2 of radiohead music videos remade in animal crossing
97,AnimalCrossing,,Chabwick’s place
98,AnimalCrossing,,"My character waved the clipboard like a fan earlier. I have been unable to recreate this since, does anyone know why this happened"
99,AnimalCrossing,[removed],GIVEAWAY or get inspired
100,AnimalCrossing,"Animal Crossing has always been near n dear to my heart, I really enjoyed the original Gamecube release and City Folk as well. However, I was never really able to get into New Horizons. The idea of creating the island to your liking interests but overwhelms me. Partly because I work full time now so I feel like I have no time to grind and wait days for stuff to happen in-game. Anyways, my girlfriend also recently just got into the series and wants to enjoy the new content in NH but we're so far behind that we've only got about 4 neighbors and lots of work to do (months of work I assume). So I come with a few questions and I figured Reddit is the place to go!

1. Can I time travel by switching the date on my Switch? (Will there be any negative affects on our island?)

2. Is there a Meta or best way to progress faster or gain bells/resources? I want to get us caught up as quickly as possible. 

3. My girlfriend is unable to do certain tasks and things unless she's on my account, is there a way to fix this or is it meant to be this way? I'm pretty sure I'm like the ""president"" kind of thing since I started the island. 

Thanks and any help at all is very much appreciated!",Best Way For Beginners To Catch Up Quickly?
101,AnimalCrossing,,What a great decision to download Danny DeVitos face
102,AnimalCrossing,,Thank goodness I caught it first before it’ll get me.
103,AnimalCrossing,,Crops! (Ps sorry about quality it's the best I can get)
104,AnimalCrossing,,Did not know you could get a double rainbow
105,AnimalCrossing,[removed],DJ K.K.
106,AnimalCrossing,,Any suggestions on what to do with this area? It used to be a nature area on the fourth level but it got nuked so idk what to put here now. Any ideas?
107,AnimalCrossing,,I GOT SHINO ON MY THRID !!!! NMT???? WHAT
108,AnimalCrossing,,Any Splatoon players?
109,AnimalCrossing,,none of the villagers know about my secret basement witch's lair. 🧹🖤🪄
110,AnimalCrossing,,Some Autumn /Fall inspired designs! :)
111,AnimalCrossing,,Just ROMAN around my island … do you have a few favourite places that you’ve made? 🤗💖🤗
112,AnimalCrossing,,School’s in session!
113,AnimalCrossing,,tea shop for my sweet Tia 💐
114,AnimalCrossing,,"For those of you thinking “I got too much poki!”, think again: I went from 280k to 384 poki. Must. Have. Everything."
115,AnimalCrossing,,I made a two floor home for Celeste ✨
116,AnimalCrossing,,Welcome to the murder shed
117,AnimalCrossing,,The model kits has a model of the Nintendo hq in Japan
118,AnimalCrossing,,This was just downright luck.
119,AnimalCrossing,,Should I?
120,AnimalCrossing,,Eunice Cozy Winter Cabin
121,AnimalCrossing,"Lately I’ve been obsessed with pairing roommates, so what’re some of your pairings you guys have done or plan to do? 

I tend to do it by room aesthetic, so I’ve paired these so far:

Lucky &amp; Ankha
Jitters &amp; Hamlet
Pekoe &amp; Shino
Beau &amp; Erik
Cephalobot &amp; Cobb
Flurry/Sprinkle",Roommate Ideas?
122,AnimalCrossing,[removed],Free DIY recipes
123,AnimalCrossing,,Walked in on Raymond sleeping like this… 💤
124,AnimalCrossing,[removed],How do I do all of that turnip stuff?
125,AnimalCrossing,,Ruby casually remembering someone visiting my island 15 years ago! 😳
126,AnimalCrossing,"I've designed my villager based on a character that has no arms, and I'd like to be able to colour in her hands to make it look like she's wearing a long-sleeved shirt with empty sleeves. Is there anything I can do?",Gloves / Hand coverings?
127,AnimalCrossing,,Anyone wanna come hangout at my island (80NRF)
128,AnimalCrossing,,Some concepts are truly.. interesting 😅👀
129,AnimalCrossing,,"If anyone's looking for the Royal Crown in the Able Sisters shop, I have it. So DM me if you want to come over."
130,AnimalCrossing,,Peppa Crossing
131,AnimalCrossing,"So I want to have a Magi theme for my new island. If you have seen the anime that's great but not needed. 

I'm planning what items/diy would fit the theme. I'm mostly taking inspiration from Sindria and the magic academy. 

The new castle walls is a must:)

If you haven't seen it think of big family, festive, exotic, magic, cozy vibes. Many small shops.

&amp;#x200B;

So many items in the game it's hard keeping track of them and easy to miss some",I need help with my new island theme
132,AnimalCrossing,,I guess 2.0 introduced human experimentation?
133,AnimalCrossing,[removed],cataloging
134,AnimalCrossing,,My heart! Look at my smol boi Marshall cooking away!!
135,AnimalCrossing,,Another series of my island pictures! Has changed...a little bit.
136,AnimalCrossing,,Made Snake Plissken
137,AnimalCrossing,[removed],Help
138,AnimalCrossing,[removed],Villager hunting
139,AnimalCrossing,I restarted my island and i already purchased the happy home paradise DLC on my old island and now I can’t get it to work on my new island help me please,HELP ME
140,AnimalCrossing,,"Elimination game round 3! Unsurprisingly Rocco got voted out. Remember, vote for your least favourite villager"
141,AnimalCrossing,,Two questions….
142,AnimalCrossing,,My bedroom redesign
143,AnimalCrossing,,I'm calling the health department
144,AnimalCrossing,,More of Flick and CJ
145,AnimalCrossing,,With the help of some of the community I've been putting together a guide on how to unlock new 2.0 features.
146,AnimalCrossing,,"Just noticed, there’s a Paradise Planning advert that plays on the radio occasionally. You can hear Lottie, Nico and Wardell."
147,AnimalCrossing,,"Went to Redd's Raffle to take some food items, won a book instead - and I love it! 😆"
148,AnimalCrossing,,Ankha Rita (LovelyMaggieWings)
149,AnimalCrossing,,I got a Celest plushie at comic con!
150,AnimalCrossing,[removed],Do y’all think it’s possible to restart the DLC without having to restart your whole island??
151,AnimalCrossing,,Marcel slept through my school's grand opening
152,AnimalCrossing,"[removed]

[View Poll](https://www.reddit.com/poll/qtudks)",What is everyone's favorite part of the update?
153,AnimalCrossing,,Redesigned my 1st Villager Home!!! :D
154,AnimalCrossing,,Buying Isabelle a cup of coffee turned out unexpected...
155,AnimalCrossing,,Does anyone know why I can’t donate to this particular Lloid? (The one to the right of Leif.) I never contributed bells to this Lloid and can’t imagine a villager finishing it.
156,AnimalCrossing,"i just finished setting up my villager houses before the update dropped, tom nook owes me 400,000 bells now i'm so salty","just a heads up, they changed villager house moving costs from 50k to 10k in 2.0"
157,AnimalCrossing,,Made this Paranormal Activity vibes video in acnh (gloomswirl polishing effect from the DLC)
158,AnimalCrossing,,Tia is so cute!! I hope she likes the garden I designed for her! She loves cherry blossoms 🌸
159,AnimalCrossing,,"What Niko lacks in height, he makes up for with lower body strength."
160,AnimalCrossing,,"Pro tip: when you build homes for amiibo scanned villagers like Isabelle and Blanca in HHP, Lottie sends you photo of them the next day! Ok about to build a dozen more!"
161,AnimalCrossing,,Lucky's Summoning Circle
162,AnimalCrossing,"How do you change who works at the facilities? I may have totally missed something but when I remodelled my restaurant yesterday I'm pretty sure I wasn't given the option to swap the workers out.
 
It'll be a bit annoying if you can't...",Changing who works in the facilities
163,AnimalCrossing,,I DID IT I DID IT (I got shino on a nfc tag)
164,AnimalCrossing,[removed],Katrina Head trauma
165,AnimalCrossing,,You can start earning today with yardstick https://t.me/joinchat/4DVlclE3kX4zOGE0 Download a telegram and Click on the link
166,AnimalCrossing,,I found my boys on a lil playdate 🐙
167,AnimalCrossing,"I only have one bridge, it’s a bunch of logs that stretch across over the water and it looks really bad. I’ve seen other peoples islands and they have better looking bridges so I was curious as to how I can get those?",(New Horizons) How do I get new bridges?
168,AnimalCrossing,,Tiny Vacation Home #3: Muffy’s renaissance manor ⚜️
169,AnimalCrossing,,Just making sure the artwork is legit….
170,AnimalCrossing,[removed],Looking to make a small ACNH friend group :)
171,AnimalCrossing,,Is anyone else already decorating for Christmas? 🎄🎅🏼🎁❤️
172,AnimalCrossing,,I feel like I got super lucky I only bought one pack of the series 5 amiibo cards when they came out and these were the cards I got
173,AnimalCrossing,,Keopi House
174,AnimalCrossing,,For anyone wondering if they can purchase the winter or summer outfits from Build-A-Bear separately. (Christmas is a coming!) the answer is no lol
175,AnimalCrossing,,70 homes decorated.
176,AnimalCrossing,"So I heard that after 33 clients Wardell talks to you, which he did. But he gave me soundscapes not the app. At this point I have done over 40 clients and when I walked in and Lottie has not given me the app. Could it have something to do with me receiving the DIYs from Niko so the game doesn’t give me the app the same day to spread out the features? Any help would be appreciated.",How do I unlock the Room Sketch app? Please help :(
177,AnimalCrossing,,I made a home for Maple
178,AnimalCrossing,,No no no...those are muffins...
179,AnimalCrossing,[removed],Piano
180,AnimalCrossing,,Come take all the extra DIYs feel free to leave a message at the bulletin board
181,AnimalCrossing,,Love this new butterflap polishing effect in my little greenhouse 🥰
182,AnimalCrossing,,Sherb and Sasha's waiter outfits 😍 there soooo cute ❤❤
183,AnimalCrossing,,Wilbur’s euphemisms get weirder every day
184,AnimalCrossing,,ACNH - Star Trails &amp; Time Lapse in 4 min - 【BGM： 戸高一生 - 星が輝く森で，劇場版「どうぶつの森」オリジナルサウンドトラック】
185,AnimalCrossing,,i thought if i kept narrowing the cliffs she’ll move away but now it looks like im holding her captive…
186,AnimalCrossing,,You've become the very thing you swore to destroy...
187,AnimalCrossing,,To buy this press the link in first comment 👇👇
188,AnimalCrossing,What do you think the best update feature is I would say the storage shed or harvs island (redd and Cyrus especially),Best update feature
189,AnimalCrossing,,Idk what it gives you because it wont let me type in the code (check chat)
190,AnimalCrossing,,Ankha
191,AnimalCrossing,,Clay is an assman
192,AnimalCrossing,,"I finally built a boutique, and here you have my first customers"
193,AnimalCrossing,,"In ""Animal Crossing: The Movie"" it is implied that Whitney dated Apollo. I couldn't miss opportunity to move them in together. &lt;3"
194,AnimalCrossing,,Okay but does your island have an IHOP 💅💅💅
195,AnimalCrossing,,I made a Canadian Tire for my Canada-core island 😌
196,AnimalCrossing,,ACNH - Star Trails &amp; Time Lapse in 4 min ——&lt;BGM： 戸高一生 - 星が輝く森で，劇場版「どうぶつの森」オリジナルサウンドトラック&gt;【动森】星轨4分钟
197,AnimalCrossing,,I made a Canadian Tire for my Canada-core island 😌
198,AnimalCrossing,,Raymond and Punchy enjoying Cranston’s yard
199,AnimalCrossing,,Water aerobics with Coco
200,AnimalCrossing,,A small preview of my Gucci store. It is a recreation of their flagship Toronto store 🛍
201,AnimalCrossing,,yes.
202,AnimalCrossing,,When you see a villager you kicked from your island at the Happy Homes Paradise Resort.
203,AnimalCrossing,,My school- the Teekademy of Science!
204,AnimalCrossing,,Bruce is visiting Shino and they have the cutest little friendship going on here
205,AnimalCrossing,,"Decided to dress my character up as a goth. Then I realized how paltry the selection of mouths are. No frowns, no shocked. I mean compared to the many more amount of mouths in the Mii Makers this is kind of sad."
206,AnimalCrossing,,Oh no! My Pietro! He’s broken!
207,AnimalCrossing,,"My friends own a coffee shop (Controversial Coffee in Seaside, OR) and the sign today has a familiar face~&lt;3"
208,AnimalCrossing,,Was inspired by Elon Musk when naming this.
209,AnimalCrossing,,Bruce is visiting Shino and they have the cutest little friendship going on here
210,AnimalCrossing,,Pascal's truths are getting more confusing to me...
211,AnimalCrossing,So the inventory hasn't changed for anyone in the past 5 days. Does anyone else have this going on for them or is it a glich? Kicks has had the same things for sale and keep checking Redd for new art but just the same stuff. Same with Leif and that's the one I've been checking everyday hopeing forn suger cane. Does it change ever week if so its sunday I'd think it would change today?,The Shops at Havs Plaza are broken
212,AnimalCrossing,,My friend had an Animal Crossing themed birthday party
213,AnimalCrossing,,Avatar labs 🔬🧬
214,AnimalCrossing,[removed],Darner dragonfly glitch?
215,AnimalCrossing,"So everyone at Harv's Island has been selling the same stuff all week long never changes. Shouldn't it change daily or does it change week to week? I don't understand this. 

Carrots are the only veggie I need so if anyone has 10 carrots 🥕  I'm happy to buy them or trade.",New Update/ Harv's Island
216,AnimalCrossing,,Beach Hut for Butterpup ♡
217,AnimalCrossing,,Okay but does your island have an IHOP 💅💅💅
218,AnimalCrossing,,THERE'S A YACHT???????
219,AnimalCrossing,"Has anyone else been invited to a villager’s house and then not allowed to leave? I was just at Zelle’s house, and every time I tried to leave he started sweating and saying things like “can’t you stay a little longer”. No matter how many times I tried to walk out, he just kept begging me to stay. I eventually had to just close the game to break the loop. Is this a new game thing, or a glitch?",Held Hostage?
220,AnimalCrossing,[removed],Help
221,AnimalCrossing,,Now you know Dom can kick your ass easily
222,AnimalCrossing,I completed the photo tutorial and what not on Harv’s island already so I’m confused why this is happening. I really want one of the new hair styles and to visit the plaza but the event won’t seem to trigger. Is there any way to force this to happen?,I think my game is bugged… I went to Harv’s island for the first time a several days ago and he still won’t send me a letter inviting me to visit again.
223,AnimalCrossing,[removed],New Horizons Update
224,AnimalCrossing,,I am overjoyed because of this tees.
