,subreddit,selftext,title
225,AnimalCrossing,"Reds, Kicks, Sahara, and Leif have all had the same items for 4 days in a row for me. Do they change weekly? Maybe I need to buy up all the stock? Please let me know if you know any secrets or something I’m doing wrong!! Thank you for reading &lt;3",How often is the inventory suppose to change for the stalls in the co-op?
226,AnimalCrossing,"So one day I decided to create my own designs of clothes in the Able shops. I realize now I don’t like them and my villagers will constantly wear them. I know the villagers don’t wear the original designs the shop had from “Someone from Anyisle”. If somebody posted those designs in my Able Sisters shop, would my villagers wear those?",Question about designs from Someone on Anyisle
227,AnimalCrossing,"Right now my town is totally overrun by flowers. I want to clean them all up but I also want to make a rock garden so it will be easier if the flowers cover up spots on my island. Yesterday i started clearing some space for the rock garden and dug up a little over 100 flowers. Digging them up and covering the holes took about 30 mins. Now im second guessing whether or not i want the rock garden there or somewhere else and its stressing me out cause i know it will take an insanely long time to make and im scared i wont like it in the end and it makes me stressed to even start. Also stressful since i feel like theres no going back once i terraform too much and i feel like i need to prepare more for how long it will take. If i get deep into it and dont like something it will have been a waste of time thats tough to make normal again

Obviously a rock garden is not something nintendo planned for us to make but i felt the same way while i terraformed a land bridge. Stressed to start because i knew i wouldn’t be able to make things normal again once i started and worried that i would spend all the time working just to not like it and have it ruin what i used to like. Anyone else find themselves with this mindset?

My island feels like a lot of halfway done ambitious projects that are just floating around my mind cause of this mindset but i just get too stressed to start making big changes",Does how long terraforming stress anyone else out?
228,AnimalCrossing,[removed],How many points does a food gift give?
229,AnimalCrossing,,the film studios :)
230,AnimalCrossing,,"No need to waste sweat for nothing, either you wait or make your own. I got my 20 cards for 10 dlls"
231,AnimalCrossing,[removed],[LF]Petri [FT]90 NMT
232,AnimalCrossing,,(Mild spoilers for HHP) did anyone else get REALLY excited about this?
233,AnimalCrossing,,Her face the moment she knew she lost them
234,AnimalCrossing,,"Daisy Mae is trying to have me invest, and then giving me a recipe to cook my stock..."
235,AnimalCrossing,,WHY DOES THIS EXIST? WHY??????
236,AnimalCrossing,[removed],My island
237,AnimalCrossing,,R.i.p. Museum Bench
238,AnimalCrossing,,"🌸 Serenity finally has an entrance!! Oh I’m so happy I can finally terraform after restarting. Not finished yet but I’m so happy with how it looks 🌸 For those who didn’t know, I restarted my island and got rid of my island, Bliss, which I’d been posting a lot of lately - time for a change x"
239,AnimalCrossing,,I think this little incense burner is so cute!
240,AnimalCrossing,"Recently Phoebe moved out, and the house next to Celia was bought by Apollo. I didn’t know who he was so I looked him up. His aesthetic is very different to that of Celia. 

Previously I didn’t bother giving Phoebe or Celia a yard because of the small space in between their houses, but I’m hoping to give my villagers their own spaces. My island is already designed around the placement of the villager houses so unfortunately I can’t move the houses further apart without wasting a lot of bells. 

Has anyone got any ideas for items which might suit both Celia and Apollo?  That way I can utilise the space and give them a shared hang out area. I’d appreciate any ideas!",Shared yard ideas for Celia and Apollo?
241,AnimalCrossing,[removed],I need some help
242,AnimalCrossing,,I think they like the new Nordic spa I’m making 👀
243,AnimalCrossing,,little plant room 🌿💐.
244,AnimalCrossing,,Too cute 😍🤩
245,AnimalCrossing,,Isabelle Handmade Spray Painting by me
246,AnimalCrossing,[removed],Has anyone here managed to successfully play this game on PC?
247,AnimalCrossing,,You can apparently get dupes of villager photos.
248,AnimalCrossing,,"Fang and I know all about being old and sleepy midday, it’s practically our MO."
249,AnimalCrossing,,Has anyone’s villagers actually donated to the donation box? Mine’s been empty for a while 😢
250,AnimalCrossing,[removed],I need wheat!
251,AnimalCrossing,[removed],what to do with Saharah tickets now that the co-op is a thing?
252,AnimalCrossing,,I love the new camera mode!
253,AnimalCrossing,"Fairly new player wondering if you are limited to only using the designs you've downloaded only (full new design slots).

Example - i downloaded some four leaf clover design for the ground and placed on my island. Realized my empty slots are full so I saved over the design with a new one and now my orignal placement is replaced with the new design. 

Just wondering if this is normal or a glitch. Thanks",Custom designs question
254,AnimalCrossing,,still have some work to do but i love how my crochet isabelle turned out!
255,AnimalCrossing,,Tried to take a photo for his vacation house but he sent them to the hospital
256,AnimalCrossing,,Ok here me out. What if Nintendo made K.K. Slider merch but they make it like how Polo uses the Polo Bear.
257,AnimalCrossing,,*insert fortnite default dance*
258,AnimalCrossing,,Are there any people from Alaska (specifically Anchorage) in this sub? I’m curious about why I’ve yet to find a SINGLE series 5 amiibo card
259,AnimalCrossing,,From Knox’s castle.
260,AnimalCrossing,,This is very wholesome to hear.
261,AnimalCrossing,[removed],acnh villagers!
262,AnimalCrossing,,Brewster gives you the cookie recipe once you raise your friendship with him omg
263,AnimalCrossing,,Totally normal roommates.
264,AnimalCrossing,,Squid Game in ACNH
265,AnimalCrossing,,I've made a little gyroid farm
266,AnimalCrossing,,Interesting offer…
267,AnimalCrossing,,The Powerpuff Froggy Chairs were born.
268,AnimalCrossing,[removed],Accidentally picked up vines in Happy Home Paradise
269,AnimalCrossing,"Hello, I am a girl with the problems that I have mentioned in the title, I usually handle those problems more or less well, but due to my family situation (a family member very dear to me died) I am going through a rough patch, I don't even feel like getting up Sometimes I'm out of bed, sorry for my bad English and for venting myself by writing this, I wanted to ask you if this game is good because seeing images and videos of this game reassures and encourages me a bit, being a student of a fp (professional training , I don't know exactly how it would be in English) I don't have a job yet and it will take me a few months to save the money, so I want to be sure if I should buy this or another game, I tried stardew valley and I love it but you have to go too fast for me , that's why I thought of an animal to look more relaxed, thank you",Is animal crossing new horizon a good game for people with depression and anxiety disorders?
270,AnimalCrossing,,"Same here, Audie."
271,AnimalCrossing,[removed],Why isn't any of my products at the trailers on harvs island changing?
272,AnimalCrossing,,Guys I googled it. Pigeon milk is a real thing.
273,AnimalCrossing,,Attack on Titan!
274,AnimalCrossing,,I made a little video of a gamecube inspired build I did on HHP (music edited in)
275,AnimalCrossing,,I need a name for my school
276,AnimalCrossing,,Marlo’s dream vacation home..
277,AnimalCrossing,,beau’s mini farm 🥔
278,AnimalCrossing,,Ahem...
279,AnimalCrossing,,I think Stu really enjoys his new vacation home!
280,AnimalCrossing,,"My girl friend finally enjoying 2.0, she just custom made a closet."
281,AnimalCrossing,,I made a little Witcher cave area!
282,AnimalCrossing,,Gooood... GOOOOD
283,AnimalCrossing,,My first gyroid buddy :D
284,AnimalCrossing,,"FYI, you can use the custom polish to create a falling leaves effect! I used it to enhance Shino's concert 🍁"
285,AnimalCrossing,"Hey there! I’ve been looking through lists and info about villagers as I slowly change them out and redo my island, and was wondering if anyone had any suggestions?

I’m going for a kind of retro, goth-y cottage core feel. Think Dark Shadows. Right now my favorite villagers that fit really well with this are Coco and Nan.

Thanks in advance!",Villager Hunt Suggestions
286,AnimalCrossing,,What I imagine the villagers think when digging up fossils [OC]
287,AnimalCrossing,,I'm pretty sure he was called spork?
288,AnimalCrossing,,Dreaming up soundscapes with Wardell. (OC)
289,AnimalCrossing,,Two benches yet they still sit on the floor
290,AnimalCrossing,,Must be my lucky day! …a little tardy to the party but still
291,AnimalCrossing,,Has anyone been invited to their villagers houses yet? They let me take w.e. I wanted and then gave me their house song.
292,AnimalCrossing,,Made a Home on the Range for Norma and Tipper
293,AnimalCrossing,,"Well, well, well. How the turntables have turned."
294,AnimalCrossing,,perfectly polished boys!
295,AnimalCrossing,,"Finally, I can have a real snowy mountain instead of standees!"
296,AnimalCrossing,,"Same Papi, same."
297,AnimalCrossing,,I designed a new dress that I think is kinda cute! :)
298,AnimalCrossing,,I drew eight new villager concepts!
299,AnimalCrossing,,I crocheted a thwompoid gyroid!
300,AnimalCrossing,"Hello! Would you know if there are any prerequisites before I can unlock the Pro Camera settings? I was surprised that I couldn’t see the option to buy it at the Kiosk!

I’m very early in-game since I just started playing last week, no Able Sisters shop yet. Maybe there is something I need to unlock first? Thanks in advance for any info!

And yup, my game is updated!",Can’t unlock Pro Camera :(
301,AnimalCrossing,,The Roost from New Leaf
302,AnimalCrossing,"Hi y’all! Like many people, I experience frame rate drops when I walk around my island.  I've read a lot about it but no one seems to understand what really causes it. 

So I thought we could share here what areas are lagging on our respective islands! 
I’ve read that flowers, trees, and water areas are most likely to cause frame drops. 

Things I’ve noticed:
- Turning off my switch (instead of putting it in sleep mode) when I’m not playin it kinda helps a little. 
-The game runs better at night. 
-It’s worse on rainy days.
-I took a look at some « off camera » videos to see what’s rendered off screen and it seems that only Houses, Bridges/Inclines and characters are. Everything else disappears. 

Rules: 
-Describe what is displayed on the screen in the problematic area (if it’s mostly flowers, trees, items, patterns…), and what is likely to be rendered in the background too (even if you don’t see it on screen). 
- If you make any change by removing some stuff , let us know if the game seems to run better after that! 
- No messages that are just you complaining about it, it won’t help. 

——

My experience: 
I gotta be honest I’m in complete confusion. The most problematic area on my island is on the second tier and displays quite a few panels that are lined up along the cliff, one bridge and 2 inclines. There are a very few trees. Fences on both sides. No flowers. Just a few items. Road patterns as path. 
Off screen, in front of all of that there’s a river and in the background there’s Nooks Cranny. 

Things I’ve tried:
Removed half of the panels. Did not help. 
Removed items. Nothing. 
Removed fences. Did nothing. 
Reduce the size of the river. Didn’t notice any change. 
Removed Nooks Cranny from the area. Did not help. 
I even close and reopen the game for each test. 

That just doesn’t make any sense cause I have a very similar area (with the Able Sisters) with panels, roads, trees…(I mean very similar!), that is on the first tier, with no river nearby and it’s not laggy at all. 


What about you?",Frame rate Drops - let’s help each other!
303,AnimalCrossing,"I am just a few houses off from 30 so I can redo my villagers houses, and my main question is, do I have to use the recommended items for them like I do for paradise planning? Or can I put whatever I like? Most of my villagers houses are okay and I was simply looking forward to embellishing and cleaning them up, but a couple of them, *cough* Hazel and *cough* Klaus need a total overhaul lol.",Recommended items for villagers
304,AnimalCrossing,"I've been spending a lot of time on the subreddit lately and I see similar questions pop up a lot so i wanna write a post about things you might be confused about or should know about the update.

There might be some spoilers in here so stop reading if you don't want those.

First of all Harvey's island:
The shops refresh weekly, not daily
One exception is Redd, he gets new artworks whenever you buy one

Happy home Paradise:
After you played a bit of the DLC you will get the option to order any item you can use in the vacation homes from wardell which is great for cataloging.
Also useful are the vines and the glowing moss on the HHP island which can be pucked and will slowly regrow so it's basically an infinite reliable source. 
Also there will be an additional message in a bottle on the shore every day which can contain ruined, vine and moss diys. 

Farming:
The easiest way to get all mew crops is to build Leif's shop on Harvey's island first and buy the starts from there. Of course you can also get the crops from other people but please don't pay high prices, they are not worth higher prices since they are so easy to multiply

Kapp'n:
If what I've read on posts is right then these might be useful information:
Time doesn't pass on Kapp'n islands so you can use them to get fish from other timezones, also you can catch fish and insects from the seasons. 
Apparently ertain islands like cherry blossom Islands are only available if the season they belong in has already passed since your character/island was created

Gyroids:
If you have a rainy day you should dig up all spots on your island the next day since you should be able to find 2 fully grown gyroids. Kapp'n islands wjere it rains will also have extra spots with fully grown gyroids. If you didn't get the color of a gyroid you wanted you can customize them on workbenches

Cooking:
If you give something cooked to a resident on your island they will place it in theor homes. They do not eat it. 
You can get fish recipes by catching certain fish like sea bass, red snapper, dab, blue marlin and probably a lot more. 

Brewster's Café:
Your relationship with brewster will grow for drinking coffee each day. Only the first coffee a day counts. He will give you recipes and items and give you new options on how you drink your coffee. The rewards I know about are a diy recipe for the brewster cookies, a bad of coffee beans (an item, it's not a crop for farms) and a brewster gyroid. The interactions include waiting for your coffee to cool, ordering take away coffee and adding pigeon milk to your coffee.

Other:
Please be careful with decorating your island with vines and glowing moss. Visitors can steal your glowing moss without any tools (I'm not sure about vines) so if you're worried about that, be careful who visits your island. 

I hope this was interesting for some people 

If any of this information is false please tell me and I will edit it",Things that I think you should know about the update/DLC
305,AnimalCrossing,,Didn’t spend too long on Lionel’s HHP build because I was disgusted in myself
306,AnimalCrossing,,when your extrovert friend drags you to the club
307,AnimalCrossing,,☕️ made a Roost themed pourover coffee stand!
308,AnimalCrossing,,Daisy May looks so weird without her hat
309,AnimalCrossing,[removed],Diys
310,AnimalCrossing,,He remembered me...
311,AnimalCrossing,,Got curious about these photos in the roost so I pulled out the handheld camera. The details in this game are amazing
312,AnimalCrossing,,I want what they have
313,AnimalCrossing,,My Three Favorite Non-Villager NPCs
314,AnimalCrossing,,Marcie the kangaroo unlocks the Froggy chair in hhp 😁
315,AnimalCrossing,,Whoever lives on Pearl did you get a sally?
316,AnimalCrossing,[removed],So I tried to get access to Harv's island plaza
317,AnimalCrossing,,My streamer room 💞 #animalcrossingnewhorizon
318,AnimalCrossing,,Is this normal? Never used an Amibo or anything…
319,AnimalCrossing,"I have been playing on my daughter's island and her Switch, logged into my Nintendo account. I am getting my own at Christmas and I'd like to start from scratch with my player and everything.  I just read that my character and pockets, house, etc, will move to my new island. But I don't want it to. Can I prevent this or would I have to start a new Nintendo account? Hope this makes sense!",A new Switch
320,AnimalCrossing,,"Rory, Shino and Pekoe sing K.K. Jongara ^¬^"
321,AnimalCrossing,"I've got two that I bought, right now they've got Coco and Fauna on them, but can I somehow delete the data for Coco and Fauna and replace it with another villager to get into my island? or is it one  download per chip?",How do NFC chips work?
322,AnimalCrossing,,My First Group Stretching... with Gyroids!
323,AnimalCrossing,[removed],Need to fish and catch bugs plz
324,AnimalCrossing,,Come on down to Big Bill Hell's Cars!
325,AnimalCrossing,,Didn't realise you forget what treasure hunt gifts are if you save :(
326,AnimalCrossing,,Real terraforming 👷🚧
327,AnimalCrossing,"My niece has ACNH on a stitch lite. Currently, she has upgraded nook shop, able sisters shop, upgraded museum, but only yesterday finished the additional three plots and should have upgraded resident services in a few days. She does not have a campsite (waiting for the 3 plots to be occupied).

She was able to buy Island 101 with her nook miles and she can do stretching activities. However, many of the other update features are not available. Mostly, she does not have Kapp'n at her pier and does not have the option to purchase Pro Cooking at ABD. Without Kapp'n she can't get Brewster's.

Are these features only available with upgraded resident services?","2.0 Update with newer island, what's available?"
328,AnimalCrossing,,These new items have me completely enthralled 😍
329,AnimalCrossing,,Been a while since I made dome AC art !
330,AnimalCrossing,"So i absolutely love the update! I have all the shops on Harv's island. But i noticed that all the shops (Kicks, Red and Leif) only sell the same things. When do the items change? I have had Kicks for more than a week but the items are still the exact same as on that first Day. Does this Stay like this?

I would love to hear if this is the same for everyone.",Does everyone have this? (Question about Harvs island)
331,AnimalCrossing,My friend interrupted his switch whilst downloading the latest update. Now he has things like the tape deck in the plaza but not the boat at the peer!? It says he has the latest version but half the new stuff is missing and I can’t work out how to fix it,A friends update hasn’t fully worked can anyone offer advice
332,AnimalCrossing,,Happy Home Paradise DLC broke Animal Crossing on my switch - Even after deleting the game from my switch and reinstalling all I get is the same error message when I try to play the game :(
333,AnimalCrossing,,Me and Ankha just vibing
334,AnimalCrossing,,The haunted mansion - RA-7984-3611-0821
335,AnimalCrossing,,Very happy with what I've done for Marlo's vacation home!
336,AnimalCrossing,,"After over 4 months, i finally paid it off."
337,AnimalCrossing,,TIL that villagers can order take out coffee too!
338,AnimalCrossing,,My favorite house that I’ve done so far!
339,AnimalCrossing,[removed],Poki Catalog &amp; Buy Later Feature
340,AnimalCrossing,,"It’s my cake day…IDK, here’s a cake"
341,AnimalCrossing,Does anyone know if it’s still possible to find villagers on mystery island tours that already have a vacation home in Happy Home Paradise? Or do they become unavailable to recruit? I’m desperately trying to find Sherb to move to my island but sweet goat boi already has a vacation home. Have I missed my chance with that?,Inviting Happy Home Paradise clients to your home island?
342,AnimalCrossing,"Has anyone made/does anyone know of any Night Vale or just American Southwest DAs or IG accounts?

Im really leaning towards it as my next theme following the update but I am lacking inspo!

(I like to think it goes without saying in the AC community but all creators who I got inspo from would ofc be credited)",Night Vale themed island?
343,AnimalCrossing,,Judy visiting Etoile home 🥺 they’re both so cute
344,AnimalCrossing,,Tiny Vacation Home #2: Apple’s orchard kitchen 🍎
345,AnimalCrossing,,Whitney ~ “The Makeup Salon”
346,AnimalCrossing,,Community garden with new crops and mushrooms
347,AnimalCrossing,[removed],Looking to make a small ACNH friend group :)
348,AnimalCrossing,,I finished Robbie's custom design from botw/aoc in animal crossing!
349,AnimalCrossing,,"My villager Erik now works at my new locker room themed cafe ""Hit The Showers"""
350,AnimalCrossing,,I love this game
351,AnimalCrossing,"this is a repost because my other post was removed for it being a question 

this list goes least to greatest and includes the most money making strats. 

PUMPKINS: pumpkins sell for 350 bells (420 with bell boom) and when watered in both stages you will get 1050 (1260 with BB). pumpkins make easy money and are easy to get which is perfect for the early game but take time if you want to get as much as you can get out of your farms. 

&amp;#x200B;

GOLD ROSES: gold roses make 1000 (1200 with BB) already making only 50 less than 3 pumpkins and require 0 watering of the golden flowers, but if you have 10 gold flowers you can craft a gold rose wreath you can sell that for 20k (24k with BB) doubling your profits if you sold the 10 roses alone. 

&amp;#x200B;

AB&amp;PD: the AB%PD is unlocked when you have finished your home and appears in the happy home main building,  the machine inside will convert Poki to Bells at a variable rate. Each day, a new conversion rate is set. Much like Turnips, this offers players another avenue for speculation to maximize revenue. Converting Poki on the right day can earn you more Bells, this only happens after 24 or more homes. this adds up fast as you can keep remodeling the same home over and over for fast poki gains",My favorite bell making methods (not a question mods)
352,AnimalCrossing,,The crystal ball sees my tool
353,AnimalCrossing,[removed],Can I visit other islands without a Nintendo membership?
354,AnimalCrossing,,Flick! (self)
355,AnimalCrossing,,Daisy Mae working overtime..
356,AnimalCrossing,,The secret wasp problem on everyone's island
357,AnimalCrossing,,Woke up to find Marlo at my campsite!
358,AnimalCrossing,,Dreams about love and life~
359,AnimalCrossing,,Pascal's truths are getting more confusing...
360,AnimalCrossing,"Im going to have: cherry, kyle, marlo, molly, petri, pietro, piper, rudy and stitches

[View Poll](https://www.reddit.com/poll/qtor8x)",Need help picking the last villager for my island
361,AnimalCrossing,,"20 years later, it still haunts me"
362,AnimalCrossing,,"After seeing the idea on this sub, I've become obsessed with using partitions and accent walls to make porches! Here's 3 of my favorite ones I've done!!"
363,AnimalCrossing,,Hol the fuck up
364,AnimalCrossing,,Something for the history books
365,AnimalCrossing,,tried to do Marshal's vacation home~
366,AnimalCrossing,Hey. I think I encountered a bug. Tom Nook sends me the same letter every few days and refunds my pro decorating license. Has anyone seen anything like that? Is there any way to prevent it? I don't want to abuse it. I know it's a dumb question and in this case it's not even my fault but can people get banned for using such glitches? Thank you in advance.,Tom Nook keeps refunding my pro decorating license every few days.
367,AnimalCrossing,,The pictures on Brewsters wall
368,AnimalCrossing,,A pink palace
369,AnimalCrossing,,This is one of the best item they added !!
370,AnimalCrossing,,Small gyroid collection
371,AnimalCrossing,,"After 58 tickets, im screaming"
372,AnimalCrossing,,Being able to clap along with Kapp'n's song sustains me in ways I didn't know was possible...
373,AnimalCrossing,,I can't imagine why...
374,AnimalCrossing,,"What a nice rainy day, everyone’s happy"
375,AnimalCrossing,,"Making rooms is great in Happy Home Designer! My movie star, Marlo, even has his own camera at the end of his bed 😏"
376,AnimalCrossing,,"Made a ranch room for Tipper, compete with special milking room 😂"
377,AnimalCrossing,,Shino sitting her butt down right in middle of my path to read but she's cute so I'll forgive her
378,AnimalCrossing,,My bf doesn’t like my beautiful nature bathroom. Why doesn’t my bf like my beautiful nature bathroom?! 😫
379,AnimalCrossing,,"House for Deidre, first one I'm happy with 🍂🍁"
380,AnimalCrossing,,Absolutely cursed content
381,AnimalCrossing,"Hey guys! I’ve been looking for cherries for the last two months to complete my fruit orchard. Would anyone be able to help me out in getting some? My island has pears, or I can send some bells for them!",Looking for Cherries!
382,AnimalCrossing,,The gyroid leader and her minions
383,AnimalCrossing,,Now Roald got his dream of a Race course
384,AnimalCrossing,,"FYI, you can use the wall spotlight behind the system kitchen for a nice effect!"
