,subreddit,selftext,title
752,AnimalCrossing,"&amp; she didn’t say “Remember that bad times are just times that are bad” at the end!

I’m legitimately heartbroken. Someone please tell me she says it at some point.",I just unloaded Katrina…
753,AnimalCrossing,,"Henry's pit stop on his ""Voyage of Self Discovery"""
754,AnimalCrossing,,Some of my favorite yards I've made so far
755,AnimalCrossing,,How do I visit the mystery island to adopt a villager now? The ‘I want to go somewhere’ option isn’t there anymore.
756,AnimalCrossing,,I've finished celeste embroidery hoop commission 🌟🌙
757,AnimalCrossing,[removed],Log Chair DIY
758,AnimalCrossing,,my otp on my island is pekoe + rodney so last night i lost my mind when i saw they were together at his home so naturally i took a bajillion photos
759,AnimalCrossing,,Just another job giving employees pizza instead of meaningful raises
760,AnimalCrossing,,Uhh.. Tipper? You alright there?
761,AnimalCrossing,,Orville and Wilbur flew over for a cup of coffee!
762,AnimalCrossing,,Next villager choices… who should it be?
763,AnimalCrossing,,Orville and Wilbur flew over for a cup of coffee!
764,AnimalCrossing,"[removed]

[View Poll](https://www.reddit.com/poll/qtehdm)",Who should I move onto my island next?
765,AnimalCrossing,,Got some gnomes!
766,AnimalCrossing,,Look who swam in to have coffee with me! #pascal
767,AnimalCrossing,,"I got super lucky, the right villager wanted out yesterday and found her after 10th mystery island today."
768,AnimalCrossing,,Coffee with Orville and Wilbur!
769,AnimalCrossing,,Spent around two hours on Static’s home. See notes in second picture.
770,AnimalCrossing,,Late night exercise session!
771,AnimalCrossing,,"Concert time with a few of my fave villagers! (Nate, Ketchup, Ione, Tank)"
772,AnimalCrossing,,"Hiring a Designer? (Outdoor Decorating, Not Terraforming)"
773,AnimalCrossing,"looking for a wooden double bed and (4 if possible) wooden end table. if you have the DIYs to give away that would also be good and possibly even the wooden table or bookshelf DIY. i’ll pay and also provide materials!
thank youuuu 💕",looking for wooden items crafted for me or the diys
774,AnimalCrossing,Thx in advance.,"Dear Nintendo: please add key word search abilities when we decorate in HHP DLC. Deep into game, with over a couple thousand items, we need this!"
775,AnimalCrossing,,Pen pals to roommates plus Chevre's original theme request
776,AnimalCrossing,How do I get a tv fast,I don’t play frequently but I want to know just for when I play for a long time
777,AnimalCrossing,Does anyone know what milestones occur after technically completing the DLC at 30 homes? I’ve heard about unlocking a gallery at the cafe. I’ve also seen some people say KK slider does a disco party every Sunday and it’s not just a one time thing. Can anyone confirm?,Ending of Happy Home Paradise
778,AnimalCrossing,,Is it worth to reset ? Why can’t I move the town hall ? Over time I realized I messed up and it’s driving me nuts because the town hall is in the way of what I want to do.
779,AnimalCrossing,,Everyone else is decorating vacation homes and I'm sitting in my house listening to my gyroids for 45 minutes.
780,AnimalCrossing,,"My first ACNH x Pokémon build! Hammerlocke, Galar from Sword &amp; Shield."
781,AnimalCrossing,How do I find a tv,I play frequently but I kinda want to know
782,AnimalCrossing,,I've had a Froggy Chair flag since the game came out. Now I finally have a real froggy chair to go with it.
783,AnimalCrossing,,Chilling with the girls
784,AnimalCrossing,"Now that we have so many custom pattern slots thanks to 2.0, I kinda regret deleting the default custom patterns that you have when the game begins. Is there any way to get them back (in an editable state, I mean - I know I could get them back through the online portal code, but they wouldn’t be editable, right?)",Is there any way to recover the default custom patterns if you deleted them?
785,AnimalCrossing,,Bidet Light
786,AnimalCrossing,,When you purchase your first ceiling decoration (paper chain) and your ceiling is like bye-
787,AnimalCrossing,,Cozy Little Design
788,AnimalCrossing,,I made Sprocket’s catchphrase “dingleberry” and it really sounds like he’s saying it
789,AnimalCrossing,,I’m creating an army of these bad boys
790,AnimalCrossing,,"Rough draft of how I want my island to look, not restarting. Working with the location of where my residence hall is."
791,AnimalCrossing,"My daughter got Hazel. I said, ""oh I used to have her. I like the squirrels. I have a white one."" She said, ""you have Marshall?!?"" I had no idea. She said he's like one of the top characters. 

He came to the campsite and I thought he was cute so I invited him to stay. I hardly talk to my islanders but since I found out, he's my new BFF. Lol!!!",So I found out I have a famous islander...
792,AnimalCrossing,,My husband with his bulldozer
793,AnimalCrossing,,MTG Forest chain banner
794,AnimalCrossing,"Dodo is GWSSN, free DIYS on right side",Molly making Plain Pancakes
795,AnimalCrossing,,Does anyone in here have this island name
796,AnimalCrossing,,Really wish I could eat at this ramen shop I designed for Croque! 🍜
797,AnimalCrossing,[removed],Does anyone know how to flatten a Island
798,AnimalCrossing,,Memorial for my grandpa. I miss you everyday. 💝
799,AnimalCrossing,,Was so happy that Shino came to my happy homes beach! But now I don't think she can become a normal villager. Ruined 😭
800,AnimalCrossing,[removed],Harvs Island
801,AnimalCrossing,,My little restaurant 🧡
802,AnimalCrossing,,They forgot to set the comic book to english when they released the game cube version for English
803,AnimalCrossing,,Does anyone have this map layout. Looking for ideas..I hate my island and want to redo it but no idea where to start! 🥺
804,AnimalCrossing,,Hey! Need some tips for my living room please
805,AnimalCrossing,,[Top 15] Animal Crossing New Horizons Best House Interiors
806,AnimalCrossing,,Loving the new camera in game and the castle set 🏰🏰🏰👌👌👌
807,AnimalCrossing,,I recently started over because I destroyed my original island trying to remodel and I wanted to share some of my new villagers with you!
808,AnimalCrossing,,Lionel is into some weird stuff...
809,AnimalCrossing,,Memorial for abuelito. I miss you everyday.
810,AnimalCrossing,,Here's my classroom! I've never had this much fun playing animal crossing before! It feels so good to just decorate with all this furniture available.
811,AnimalCrossing,,All Too Well- Animal Crossing’s Version
812,AnimalCrossing,,Made a little memorial site for my grandpa who passed away this year. I miss you everyday. &lt;3
813,AnimalCrossing,,"McScuse me, but what?"
814,AnimalCrossing,[removed],Dessert Shop Interior Design
815,AnimalCrossing,[removed],What is one feature you miss from previous games?
816,AnimalCrossing,"hi ! so basically my family have two switches, one is mine and the other is for everyone else. both switches share the same nintendo account so that games purchased on one console can be played on the other. this has never been a problem until now ( and even now i'm not sure if it's related ). i bought happy home paradise on the family switch and my sister has been able to play it fine however after downloading it i cannot access it on mine. this may also be due to the fact that i've just restarted my island but i honestly have no clue. any help is appreciated, thanks :D",i can't access happy home paradise
817,AnimalCrossing,,Dessert Shop Interior Design | ACNH Happy Home Paradise | Speed Build
818,AnimalCrossing,,Zoomies
819,AnimalCrossing,,Look who visited my island today
820,AnimalCrossing,"I used to find him all the time. Now I only need 2 items before I get my golden shovel and he never floats up anymore! Every morning I run around my whole island looking for him so there's no way I missed him. And now isabelle says who's there but so far she hasn't mentioned the bird. I still look. I want my shovel, 😢!",Omg I haven't seen that bird in a month of Sundays.
821,AnimalCrossing,"Not sure if it'd help anyone else, but I spent a bit of time putting together a Google Sheets tool that helps players figure out what villagers they may want on their island.

&amp;#x200B;

[Link to Villager Comparison Tool](https://docs.google.com/spreadsheets/d/1qTR8_xOTnsNNK-ZfaLUvCIzClnmLDQP0HL90L-0rtEc/edit?usp=sharing)

&amp;#x200B;

I built it for myself because I wanted a good mix of personalities, hobby preferences, animals types, etc. and there are are just **so many** villagers I couldn't reasonably decide without an easier way to compare everyone.

Hope someone else finds this useful!",Animal Crossing: New Horizons — Villager Comparison Tool
822,AnimalCrossing,,"It’s Diabetes Awareness month, so I made an I 💙 Insulin sign, and a dress with a Dexcom and Insulin Pump Site visible"
823,AnimalCrossing,,Chill Regretti.. I just wanted a coffee.
824,AnimalCrossing,,College has been hard on me the past few days and Wardell has been my comfort character and today while testing out reactions I discovered that it can look like as if I'm hugging him. I feel very pleased so I thought I'd share
825,AnimalCrossing,,An abstract painting of a gyroid brewster has
826,AnimalCrossing,,"It’s simple, but I recreated the McDonald’s I worked at in high school :’)"
827,AnimalCrossing,,An abstract painting of a gyroid brewster has
828,AnimalCrossing,[removed],Happy home paradise restaurant
829,AnimalCrossing,,I got my dream villager! So I did a quick sketch of him to celebrate! I'm so happy!
830,AnimalCrossing,[removed],Hitting rocks
831,AnimalCrossing,,Brewster has pictures of his old cafe on his wall.
832,AnimalCrossing,,Feeling fresh with my new chair
833,AnimalCrossing,,A story in two photos. I did the walk of shame to Wilbur.
834,AnimalCrossing,"Hello! We are currently troubleshooting some issues, and both google and the main ACNH discord do not have answers. 

I have the DLC on my main account, AND my girlfriend purchased the DLC on her account, on the same switch. Same base island, but mine is the main. I purchased mine at first, when she tried to play, she got a prompt saying she couldn't, so she bought it on her account, and can start it. However, 

I can utilize the happy home DLC, and have the ""I want to go to work"" option, but she does not. Do we have to get to a certain point on the main player for hers to have this option? Is there something missing? Any suggestions, things to try, etc. thank you kindly &lt;3","Happy home DLC - second player unable to utilize DLC, DLC is purchased"
835,AnimalCrossing,,[Nooks]184 i’ll have my gates open for most the night! DM for doodoo code 💩
836,AnimalCrossing,,"I have many, many questions."
837,AnimalCrossing,[removed],Iron nuggets needed
838,AnimalCrossing,,Decisions were made.
839,AnimalCrossing,,IM CRYING I CAUGHT IT ON MY 27TH TRY
840,AnimalCrossing,[removed],So TIL that pressing b let’s you run. Did anybody else know this?
841,AnimalCrossing,I have been on a rainy nook mile island for 3 hours and I can’t find my favourite animal the coelacanth and when ever I see a big shadow a can’t press a fast enough and sometimes I press it to soon ahhhhhh,Fishing ahhhhhh
842,AnimalCrossing,,"Audie wanted to be a DJ, but I made her queen of the local punk scene instead...close enough!"
843,AnimalCrossing,,A very relaxed Teddy. Way too relaxed xD
844,AnimalCrossing,,Wut
845,AnimalCrossing,,[Top 5] Animal Crossing New Horizons Best Kitchens
846,AnimalCrossing,,Restarted My island. And in need of flowers and fruits. Anything would be appreciated.
847,AnimalCrossing,,Some island life serotonin for you 🌺 (Sound on!)
848,AnimalCrossing,,Decided to cosplay that zelda guy
849,AnimalCrossing,,We are in a long distance relationship since one year and 6 months. There’s no one day where I regret the idea that I had of gift her a nintendo switch for play with me. She made this surprise for me and honestly I don’t need no more. I love you N. ❤️
850,AnimalCrossing,,"Ah yes, thank you!"
851,AnimalCrossing,,Some island life serotonin for you 🌺
852,AnimalCrossing,,Romantic Cafe Moodboard Inspiration
853,AnimalCrossing,,"Designed this piano venue for Fauna. If this was a real venue, I would totally visit."
854,AnimalCrossing,,Ya wanna join me island? Dodo code: FSYSW
855,AnimalCrossing,[removed],Does anyone else hate Mira?
856,AnimalCrossing,,I love the ability to decorate your own villagers home that unlock deep into HHP! Ankha and Stitches homes never looked better!
857,AnimalCrossing,[removed],My Dream Address
858,AnimalCrossing,[removed],What’s your favorite 2.0 KK song?
859,AnimalCrossing,"If you just got the Sanrio cards and you have the Roost, you can just invite them to the Roost instead of to your campsite and all their items go right into your Nook Shopping! 🌈",Sanrio Amiibos in the Roost gives the items!
860,AnimalCrossing,[removed],About the dlc…
861,AnimalCrossing,,Little dreamy train station behind my plaza 🌸
862,AnimalCrossing,,When a stagehand accidentally walks on camera during filming
863,AnimalCrossing,,I just want all the gyroids...
864,AnimalCrossing,,I am reworking some areas on my island with the 2.0 items
865,AnimalCrossing,,Welcome to Happy Hospital! This is my favorite build I've done so far
866,AnimalCrossing,,I thought a cow would want to vacation AWAY from a ranch… 🤷🏻‍♀️ oh well it was fun to make!
867,AnimalCrossing,[removed],Help with Paradise planning.
868,AnimalCrossing,,I see why everyone hates Lionel
869,AnimalCrossing,"Hey, so I’m currently changing all my villagers by making them move out and then villager hunting. 
I’m done to the last villager I need to move out. I’ve been trying for 6 hours straight and every other villager has had the thought bubble BUT HER. Is there any reason that she doesn’t get the moving out bubble or am I just being the unluckiest person in the world?😭
Thanks",Can’t get a specific villager to move out
870,AnimalCrossing,,Next finished Ankha’s ears! 😻 made by me
871,AnimalCrossing,,"... He's right there, Gayle... He can hear you"
872,AnimalCrossing,,[Top 10] Animal Crossing New Horizons Best Orchard Layouts
873,AnimalCrossing,,Blue castle 🏰
874,AnimalCrossing,"Okay, so I've been playing since the GameCube days. And since then, I've had dreams about playing Animal Crossing because it's literally the best game ever.

But quite often in these dreams, fish shadows swim up the beach and out of the rivers. I can still catch them with the rod though. And some shadows in the big lakes are as big as the museum itself. Does anyone else have dreams like this?

Other dreams involve tarantulas and scorpions following me into buildings, and my house having even more rooms (I *wish*). The max for the latter has been 6 rooms per floor for a total of 18 rooms max, with staircases in each room to go up and down floors.",Fish shadows on land
875,AnimalCrossing,,"TIL: That you can placed stuff on stoves. Probably something everyone knew but I thought this was the coolest thing, especially when making the restaurant in the DLC!"
876,AnimalCrossing,,Here’s some more shots of my Snow White theme! Can’t wait to get more items and paths to do the rest of the island 🤗
877,AnimalCrossing,,One hidden gem from the update… the Nintendo Switch Online app got updated with an island newspaper and turnip tracker!
878,AnimalCrossing,,Mister Turters is talking!
879,AnimalCrossing,,"I’m loving this new Forbidden Alter item, along with the Mini Dharma from Katrina"
880,AnimalCrossing,,Found this at Ollie wonder mart today for 20 bucks 💀 I had to get it. It’s HUGE
881,AnimalCrossing,,My villagers are always bullying me.
882,AnimalCrossing,I just started HHP and have built 4 homes. I noticed I only have access to items that previous homes had on orders. I thought we were supposed to have access to alot more items. I had a villager that wanted a cooking theme home and I couldn't even add an outdoor barbecue for him. Am I doing something wrong?,Happy Home Paradise and limited items
883,AnimalCrossing,[removed],Hi guys me and a friend are looking f to tour someone’s town just for some inspiration and some chit chat dm me or comment if interested/)
884,AnimalCrossing,"Hello im new to ACNH and ive played for 4 days without timeskipping, currently im at home so i have all the time in the world to actually play but the games designed to take maybe 1-2 hours a day it would seem. Many things tie into time in the game which is cool and all but, i kinda just wanna play, but i also feel like im cheating....  


 So now I ask, do most of you timeskip or do you actually wait?

[View Poll](https://www.reddit.com/poll/qtbybt)",Do you timeskip or not?
885,AnimalCrossing,,A little Froggy House for Toby
886,AnimalCrossing,,Lionel's Shitter Shack
887,AnimalCrossing,,Skagogo’s Grocery Store is officially open for business!!! Thanks to everyone who helped me out!!
888,AnimalCrossing,,This was easily one of my favourite things I've ever seen in this game 😭
889,AnimalCrossing,,Skagogo’s Grocery Store is official open for business!!! Thank you to everyone who helped me out!
890,AnimalCrossing,,Skagogo’s Grocery Store is officially open for business for all the lovely villagers!!! Thank you to everyone who helped me and let me catalog!!!
891,AnimalCrossing,,On the next episode of HHP’s Cribs…
892,AnimalCrossing,,"Welcome to the trailer park, boys! Cyrus, smokes. Let’s go."
893,AnimalCrossing,,Back with some better looking coins!
894,AnimalCrossing,,they said 🥰
895,AnimalCrossing,[removed],Question!
896,AnimalCrossing,[removed],"Turnips, help me :)"
897,AnimalCrossing,,"You guys liked my drawing of Molly, so here’s a portrait I drew of my own character 🍄"
898,AnimalCrossing,,Realised koalas don't eat bamboo and want to change location. What happens if I quit?
899,AnimalCrossing,,I made a Tom Nook christmas tree
900,AnimalCrossing,,"You guys liked my drawing of Molly, so here’s a portrait I drew of my own character 🍄"
901,AnimalCrossing,,My options for the day… one of these things is not like the other…
902,AnimalCrossing,,Marlo at home
903,AnimalCrossing,,Gyroid concert
904,AnimalCrossing,Brewster Song,Brewster Gyroids Reaction Song | ACNH
905,AnimalCrossing,,I.GOT.CEPHALOBOT. WHY DO THEY VISIT WHEN I DON’T EVEN HAVE A PLOT OPEN?!
906,AnimalCrossing,[removed],Item help
907,AnimalCrossing,,Really enjoying using partition walls to make apartment style layouts
908,AnimalCrossing,,Underwater Room &amp; Beach Yard 🏖 🐠 🐙 #anotherhappycustomer
909,AnimalCrossing,,Making a gyroid chess board. The hardest part will be collecting 15 more Wallopoids fir pawns
910,AnimalCrossing,,Underwater Room &amp; Beach Yard 🏖 🐠 🐙 #anotherhappycustomer
911,AnimalCrossing,,My little farm next to my house.
912,AnimalCrossing,,My money is on Raymond
913,AnimalCrossing,,The new camera angles make even my island look great!
914,AnimalCrossing,,Any advice as to why these trees are not growing?
915,AnimalCrossing,,Drew niko for fun what do you guy's think
916,AnimalCrossing,"Has anyone else had the employees at their facilities just not be who they picked?? My mom was visiting my hospital and my nurse and doctor were NOT who they’re supposed to be supposed to be maple and Sasha but was Lucy and chelsea(who I’ve never seen on hhp), I was very confused. I also had an issue at one point of the employee shown on the info tab in the app being different than who was actually employed. So it would show chelsea instead of maple. What is going on? Bug?",Wrong employees at hospital?
917,AnimalCrossing,,Can you find Filbert? [Super Hard!]
918,AnimalCrossing,,"No, no, NO! You are NOT Sasha!"
919,AnimalCrossing,"Just got back into playing and I’m clearing off everything to set up for Christmas (it’s currently Easter so that tells you how long it’s been!)

Looking for Christmas/Holiday themed islands to explore for inspiration so please drop your DA if you have one! Thanks!",Christmas theme island DAs?
920,AnimalCrossing,,My Island Steakhouse 🥩
921,AnimalCrossing,,How did this person put designs on the monitors? What item is that?
922,AnimalCrossing,,Dad?
923,AnimalCrossing,,Dobie's house - RA-7984-3611-0821
924,AnimalCrossing,Thank you,Hi I’m looking for vegetables so far I have carrots sugar starts potatoes and tomatoes. If anyone could help me get the rest I don’t even know how many I’m missing.
925,AnimalCrossing,,Wardell lets you order any item you used in the dlc! I just found out! Any item I repeat!
926,AnimalCrossing,,Too cute!!
927,AnimalCrossing,,Vintage Buffet Restaurant
928,AnimalCrossing,,Brewster Gyroids Reaction Song
929,AnimalCrossing,,How do you like my kitchen design?
930,AnimalCrossing,,Cookies for my daughter’s birthday party tomorrow 🥳
931,AnimalCrossing,,wish this was my bathroom irl.
932,AnimalCrossing,It's been great reuniting with villagers that I haven't seen since the GameCube days. I made sure that Ken and Lilly had the best houses available.,The best underrated part of the DLC is reuniting with old villagers from old games.
933,AnimalCrossing,,i wish this was my bathroom irl.
934,AnimalCrossing,,Heres a few of my favorite homes I've made
935,AnimalCrossing,,My Arcane Academy!
936,AnimalCrossing,[removed],Where is my wheat and sugar??
937,AnimalCrossing,,My first rare Kapp’n island tour
938,AnimalCrossing,,When you spend all your bells on your sisters house just so she can customize it how she wants to even though she doesn’t play!
939,AnimalCrossing,[removed],Beware Gamestop
940,AnimalCrossing,,I made Celeste a little Observatory - an updated version of her wild world one 🥰
941,AnimalCrossing,,Made an outdoor patio for my cafe! (Also I think Azalea flirts for tips)
942,AnimalCrossing,,🌲 the lost castle 🌲
943,AnimalCrossing,,My vacation home for the boss Marlo.
944,AnimalCrossing,,"My Island telephone box matches my home city (Kingston Upon Hull, UK) cream telephone boxes. We don’t have the red telephone boxes like the rest of the UK due to us having a separate ISP."
945,AnimalCrossing,,Some fun pics of my castle build.
946,AnimalCrossing,[removed],Random question but in your personal opinion out of all games in the series (excluding Pocket Camp and Happy Home Designer) which do you think is the easiest to make bells in (without the bell boom ordinance or trading with other players)
947,AnimalCrossing,,Teddy wanted to look like he was moving house... I did my best
948,AnimalCrossing,,More of my garden home design!
949,AnimalCrossing,,"I didn't notice that Brewster has a picture of his cafeteria in previous games. I also loved his photo with Blathers, their friendship is so cute."
950,AnimalCrossing,I've been trying to find genuine art and new veggy plants in the market place but both Redd and Leif have not changed their inventory for days. Can someone tell me if this is a glitch or if there is something else going on.,Question about Harv's Island Market
951,AnimalCrossing,,Welcome to Farmtopia! (details in comments)
952,AnimalCrossing,,Got this at Target today. It’s the present box filled with socks.
953,AnimalCrossing,"I really want to catch a flea before they leave at the end of November, but I'm having a hard time. I was just wondering if there's a trick to get them to spawn. It'd also be good to know if they're a daily event or if going in and out of buildings would get one to spawn.",Trying to catch a flea
954,AnimalCrossing,,Club Audie: the most exclusive club in the seven seas is now open.
955,AnimalCrossing,,Here's Some Pen Art of Sasha and Marshal :D
956,AnimalCrossing,[removed],Do you guys recon I should reset my island?
957,AnimalCrossing,,When the Update Drops but You're Broke
958,AnimalCrossing,,Katt wanted a musical home so I made her a VIP tent at a music festival
959,AnimalCrossing,,I’d like new friends to have a fashion show with !!!
960,AnimalCrossing,,The drip 💦
961,AnimalCrossing,[removed],How to remove accent wall?
962,AnimalCrossing,,Bring Back Kit
963,AnimalCrossing,,Fashion show anyone ??? Win bells!!!
964,AnimalCrossing,"Me and my sister are trying to connect, and while I can visit HER island no problem, she gets a connection error whenever she tries my island. She's tried multiple files and multiple switches, so it seems like a problem on my end. But if it's my fault, how can I connect to her Island? But not reverse? Any help is appreciated!!!",Connection error
965,AnimalCrossing,,Pudge got in trouble today during Mrs. Eloise’s Music class.
966,AnimalCrossing,,Introducing Chase The Squirrel #ChaseLivesMatter Add Chase to the game Nintendo your being Namest You added my girlfriend now add me I'm jealous I want my name to share some love😭😭😭
967,AnimalCrossing,,"Hey, listen! I made a LonLon milk label, in case you wanna use it! 😊"
968,AnimalCrossing,,My restaurant came out well I think
969,AnimalCrossing,,humble flowers design i'm proud of 😤
970,AnimalCrossing,,You come into my house on the day my daughter is to be married.
971,AnimalCrossing,,Gyroids jammin out to K.K. Rockabilly
972,AnimalCrossing,,I made the Crimson Robe from Dark Souls in New Horizons
973,AnimalCrossing,,"Today I’ve found some underwater weeds, has anyone else seen this?"
974,AnimalCrossing,[removed],What’s some new things in the new update?
975,AnimalCrossing,,"Cue Wendy, validating my job resignation."
976,AnimalCrossing,,I enacted the beautiful town ordinance so that my villagers would pick up the weeds..... but at what cost
977,AnimalCrossing,,Some pics of my new room :)
978,AnimalCrossing,,"Starting a new series: Tiny Vacation Homes. First up, Eloise’s reading room 📚."
979,AnimalCrossing,,Showcasing some of the builds I’ve done in HHP that I’m the most proud of ☺️
