,subreddit,selftext,title
385,AnimalCrossing,,I made a vacation home for Orville and Wilbur to be roommates but Orville refused to let his roommate in. 😭
386,AnimalCrossing,,I made a vacation home for Orville and Wilbur to be roommates but Orville refused to let his roommate in. 😭
387,AnimalCrossing,,Does anyone know how this DIY works?? I literally only bought turnips to make it and it’s not working
388,AnimalCrossing,,First time seeing Daisy Mae without the bowl of turnips on her head! And she's eating a cookie! 🥰
389,AnimalCrossing,All fruit needed please anyone,Fruit
390,AnimalCrossing,,My progression so far !
391,AnimalCrossing,,Niko is so small he has to stand on a crate to teach the class 😭
392,AnimalCrossing,"So I want to get the Brewster part of the museum open, but apparently I need the art part of the museum open first, I have never seen Redd appear on my island before, not once... Isabelle never even announced he may have shown up. Once I updated to 2.0 and upgraded Harv's island the first thing I did was unlock Redd because I was sick of waiting, I have now purchased 2 genuine pieces of artwork from him, being the Ancient Statue (I think that's its name) and the Wild Painting Left Half, I double checked multiple sources to confirm they were real pieces of artwork before buying them both. I have attempted multiple times to donate these to blathers (even attempting it once with only these items in my pockets) and he doesn't even acknowledge they're in my inventory, I don't even have the ""I found a painting!"" option available, am I royally screwed now? Is my museum just stuck because now Redd will never visit my island, do I HAVE to get the common painting or whatever its called to push Blathers forward? I'm so annoyed I can't just find talk to Blathers about upgrading instead of having to jump through all these loops and utilising features I don't care about for 1 feature I do care about... Any help or advice would be wonderful",I think I may have severely messed up
393,AnimalCrossing,,Rare fish spotted!
394,AnimalCrossing,,What just happened ? Pikachu butterflies…
395,AnimalCrossing,,"could i trade sugar cane , wheat , seaweed , carrots for 50000 altogether? you can visit my island, drop the things and i’ll give u the bells. only one of each i’m very impatient i can’t wait for leif to sell something else 😅"
396,AnimalCrossing,,You gotta love the manipulative mom vibes
397,AnimalCrossing,some people migrate irl... and some people migrate to the other hemisphere....... so why cant i change it to match my real life seasons?? if i were to migrate to my desired location my animal crossing will be broken... moving from one hemisphere to the other in real life... but not being able to change hemisphere in the game suckssssss.,hemisphere change should be available
398,AnimalCrossing,,It looks like a postcard from days gone by ...
399,AnimalCrossing,,Something for the history books
400,AnimalCrossing,,Tom nook is most definitely apart of this
401,AnimalCrossing,[removed],any AC hoarders here :O?
402,AnimalCrossing,,omg ive never been so excited to see something in my shop
403,AnimalCrossing,,How come some custom designs layer on top and some designs go outside the lines?
404,AnimalCrossing,,Highly recommend using the handheld camera to get a closer look at everything in the museum! I have a newfound appreciation for how detailed this game is.
405,AnimalCrossing,,So proud!! :))
406,AnimalCrossing,,*All* Models &amp; Textures Ripped for ACNH 2.0.0 [DAE/PNG]
407,AnimalCrossing,[removed],Fruit needed
408,AnimalCrossing,[removed],Problem for DIY Recipes+
409,AnimalCrossing,"So I know you can’t invite villagers from the archipelago onto your main island, but does this mean they won’t be able to show up on my island at all? Say I wanted a certain villager but they popped in the dlc before I could get them, does this mean I can’t get them through the traditional means anymore?",A quick question about the dlc
410,AnimalCrossing,,I swear I’m not addicted! Remodelling all my villagers houses 😬
411,AnimalCrossing,,[OC] Hey everyone! 😊 My Flurry plush I've made ;) Green or red shirt? 💗
412,AnimalCrossing,,Pascal's truths are getting more confusing...
413,AnimalCrossing,,[OC] Hey everyone! 😊 My Flurry plush I've made ;) Green or red shirt? 💗
414,AnimalCrossing,i don’t know if this is just me but my flowers seem to be breeding without me watering them ? is this a glitch anyone else has experienced or am i just going crazy and forgetting about watering i’ve done,Flower Breeding
415,AnimalCrossing,yall i want a switch with new horizons after finding out i can call flick or cj to the roost and third wheel their date,instant realization
416,AnimalCrossing,,I’m super proud of my new dig site using mostly new items
417,AnimalCrossing,[removed],ISO duck villagers
418,AnimalCrossing,,"Velma and her new ""Roommate"""
419,AnimalCrossing,"I’m on the 2.0.1 update of New Horizons and my island has not been updating, I get the usual Isabelle, Nook’s Cranny, and Able Sisters updates everyday but I keep getting the same exact island when I travel with Kapp’n and Harv’s island doesn’t seem to update anything like Redd’s art or Leif’s plant starts, etc. It seems to only be all the new features with this issue and all of this started a day before the 2.0.1 patch update was live so I don’t think the update is the reason why this is happening. Before any of this started to happen everything updated on a daily basis like usual. Not sure if this is even the right place to ask about this but I’ve searched on Google and Twitter and I can’t find an answer on how to fix this problem. Anyone know what might be going on?",New features won’t update daily/at all on my island
420,AnimalCrossing,,I found Daisy Mae in the Roost without amiibo! (or does she have one?)
421,AnimalCrossing,,A trip with Kapp’n
422,AnimalCrossing,,Now where have I seen this ship before? 🤔 Could it be..? 😮☠️
423,AnimalCrossing,"When news came of the release for the Happy Home Paradise DLC for Animal Crossing New Horizon's, I knew it was a good time to get back into the series and lose many, many hours to this wonderful game. 

While I've been enjoying everyday in game as much as possible, something interesting has happened along the way. When it came time to change my town tune, I was at a loss as to what to do. Do I scour YouTube for an established song to make my island my own? I decided no to that, and to instead make my own. Well, what should have taken me a few minutes, turned into several hours of making several town tunes. This got me thinking of doing something a little different, a little pointless, but a lot of fun! 

I've decided I'm going to make a micro album of original compositions that can be made in game.
I'm wanting to have about 6 to 10 tracks on the album and for all of them to not only be as good as I can make them, but for them to be as unique from each other as possible. This will definitely be a challenge, but that just makes it all the more fun! 

For those who have played Animal Crossing know, the town tune creator is not only very limited, but also very basic. Songs are only a few seconds in length. You're limited to a scale of 13 notes(no sharps and flats), 16 notes in the staff total, and no real control over tempo. Basically, it's somewhat of a nightmare to compose music on! 

With all that being said, I'm very much looking forward to the challenge. I'd like to have this done before the year is up, but you just never know. I've posted 2 videos on YouTube of the songs I think will be on said micro album(linked in the comments below). 

Give me some feedback! Hope you all have a wonderful day 🙂",A fun Animal Crossing project I'm working on!
424,AnimalCrossing,,I’m very new to actual design but here is my forest/garden I just designed. I’d love some friendly advice!
425,AnimalCrossing,"I’m on the 2.0.1 update of New Horizons and my island has not been updating, I get the usual Isabelle, Nook’s Cranny, and Able Sisters updates everyday but I keep getting the same exact island when I travel with Kapp’n and Harv’s island doesn’t seem to update anything like Redd’s art or Leif’s plant starts, etc. It seems to only be all the new stuff with this issue and all of this started a day before the 2.0.1 patch update was live so I don’t think the update is the reason why this is happening. Not sure if this is even the right place to ask about this but I’ve searched on Google and Twitter and I can’t find an answer on how to fix this problem. Anyone know what might be going on?",Island seemingly stuck on the same day
426,AnimalCrossing,"I am currently at 53 residents and while most sources say the max is 30, I am still unlocking stuff.  
I unlocked a second floor to the café around 35 and a second floor to the restaurant around 45. I also unlocked a raise at some point. However I wasn't keeping track of these at any point.  
I also assume a ""party"" happens every 10th vacation home made, but I am not talking about that.  
The floor above the café is labeled as ""the gallery"" and the floor above the restaurant is labeled as a ""VIP lounge for any 2 roommates to be alone"". I was also able to name the gallery but what I named it has never popped up. The gallery didn't need anything in it to be completed but the VIP lounge required a table and two chairs.   
Trying to look for people who have the café gallery, I found a YouTube video with a comment section talking about how the school has the ability to have a second floor at some point.  
  
Both the school and apparel shop don't have a second floor at this point and nothing has a basement.",How many residents do I need in a vacation home before I unlock everything? (It isn't 30.)
427,AnimalCrossing,"He asked me if anything they do is real, fruits grow too fast, there's music everywhere and questioned tom nook and his way of getting money. Turned out he was 'joking' but i don't believe he was",Lucky got too real
428,AnimalCrossing,[removed],Who wants apple
429,AnimalCrossing,,Sasha singing K.K. Robot Synth in his Spaceship 🌌
430,AnimalCrossing,i want to see your most cursed designs!,Let's see some nightmare homes! :D
431,AnimalCrossing,,Does anyone else have this problem? My staff are suppose to be Zucker and Sprinkle but for some reason it shows Kabuki and Ione instead even when I visit from the app
432,AnimalCrossing,[removed],Are you Short on Cash? I can help out
433,AnimalCrossing,,She remindes me of Bernadette from BBT somehow
434,AnimalCrossing,[removed],Can you find new villagers on Kapp’n’s boat tour islands?
435,AnimalCrossing,"Sorry for another poll. Please help me decide. :) Thanks!

[View Poll](https://www.reddit.com/poll/qtltks)",[Poll] Overgrown farmcore island name
436,AnimalCrossing,,"Yes, I'm pretty sure, Kapp'n!"
437,AnimalCrossing,,some of my favorite photos 🥰 ( LMAO swipe for a surprise 😂 )
438,AnimalCrossing,"As weird as it is, though, I still like it.","Every time I’m playing around this time of night, I find myself relieved that I’m not as drunk as the 3 a.m. music sounds."
439,AnimalCrossing,,"Uhhhh, Kiki that’s a little inappropriate…."
440,AnimalCrossing,"Ok so it obviously is Sunday now 3:43 am Est 

I was playing ACNH and listening to KK slider’s performances since the time doesn’t restart till 5am

I did the group stretching thing with KK there and get this

Right afterwards he was gone

I did time traveling forward a day and back and he was gone for the entirety of a second Saturday.

Anybody else know what happened or can recreate this to see if it’s a fluke or something a bit more serious.",Vanishing K.K.?
441,AnimalCrossing,,Throwback to 2019 this time on Happy Home Paradise.
442,AnimalCrossing,,My local Target had a restock 🥴
443,AnimalCrossing,,"You said ""train"", right?"
444,AnimalCrossing,,I created this home for Blanca. And Lottie gave me credit for it a 15k poki! I’ll laugh every time I look at it!
445,AnimalCrossing,"Hey, 

I'm just build the building and unlocked Isabelle but I haven't gotten the customisation workshop offered to me. Is there something I'm missing? Will it appear eventually or do I need to restart?

&amp;#x200B;

Thanks",Customisation not unlocked.
446,AnimalCrossing,,Bones pup's playpen!
447,AnimalCrossing,,I was surprised when Marshal asked me to go on a treasure hunt
448,AnimalCrossing,,"Island inspo: Seeing this made me think how cool the ivy pergola would look over a koi pond ground design, and maybe surrounded by bushes or glowing moss"
449,AnimalCrossing,,Presenting the KK Philharmonic
450,AnimalCrossing,,"You come to me, on the day of my daughter's wedding?"
451,AnimalCrossing,,i wanna move my house where i could have a big yard. where do yall think i should move it?
452,AnimalCrossing,,I invited a bunch of special characters to the Roost. This is what they had to say. Shrunk and Resetti are hilarious! Poor Blanca truly has some psychological issues. Pretty deep for an AC character!
453,AnimalCrossing,,I’m so in love with this little area
454,AnimalCrossing,,My Vaporwave inspired restaurant
455,AnimalCrossing,"So last Sunday (7 days ago now) I spent the day time travelling almost a week ahead so that I could complete Harv’s island and also remodel my island. Then I saved, changed my console time back to the current day and time and continued to play. 

I’ve since noticed that what Redd, Sahara, Kicks and Leif are selling at Harv’s island have not changed AT ALL for the last 7 days 😑

I’ve saved, closed and re-opened the game multiple times and still no change…

Has anyone else had this issue?",Help! I think time travelling has ruined Harv’s island but I can’t be sure…
456,AnimalCrossing,,My Vaporwave inspired restaurant
457,AnimalCrossing,,lil grocery store 🍂
458,AnimalCrossing,,My Vaporwave inspired restaurant
459,AnimalCrossing,,There's a new Italian Restaurant in town!🍝
460,AnimalCrossing,,still working on my room but i love it so far!!
461,AnimalCrossing,,My School
462,AnimalCrossing,"Ever since I had finished the cooperative and gotten everyone, I was so exited to see what everyone would bring, however despite all sources I see saying that they change stock everyday, all my npcs have been selling the same stuff for 4 days in a row. I don't know if anyone else is having this issue but I don't wanna buy some fake art of redd just to see what other thing he's gonna put up. Or try and hope I'm lucky when leif is in town to get the remaining crops I need.",Is anyone else having an issue with Harv's campsite?
463,AnimalCrossing,,"New Horizons is my first AC, and I’ve never seen Brewster before. To me, he seems autistic. His movements seem very familiar to me. Ever wondered what he does in his downtime? I’ve started drawing that … 🤗💖🤗"
464,AnimalCrossing,,Brewsters Birthday Party?!!
465,AnimalCrossing,,He do be rollin
466,AnimalCrossing,,Where can you use the Rover Amiibo
467,AnimalCrossing,I'm using sugarcane as more of a decorative plant to flesh out a jungle area I'm working on and I've seen pictures of sugarcane in game that has 3 stalks on one tile but I can only get 2 on mine. Anybody know how to get the maximum amount? Any help is appreciated.,How do I get my sugar cane to have 3 individual plants when fully grown?
468,AnimalCrossing,,The office inspired hat I made
469,AnimalCrossing,,Brewster amiibo next in the Cafe?
470,AnimalCrossing,,Gazebo looked out of place but I love it 😆
471,AnimalCrossing,,Completed 30 homes today 🤍 #HHP
472,AnimalCrossing,,She’s always watching.
473,AnimalCrossing,,🤔
474,AnimalCrossing,,"I just tinkered with the second of these drawings, adding a background. For over 2 years I’ve been exclusively drawing on my iPad (later Pro), but recently bought a pen display to dust the cobwebs off my PC workflow. Left is my iPad drawing of Jack, right is the PC. Do you have a preference? 🤗💖🤗"
475,AnimalCrossing,[removed],the sellers in harv's island keep selling the same things and idk why
476,AnimalCrossing,,Bought the ACNH DLC and I'm not able to play it. Please help!
477,AnimalCrossing,,I just finished the DLC and this stinker made it even better with his little jumps 🥺
478,AnimalCrossing,,A bit too warm for my taste
479,AnimalCrossing,,"I got my first new character today. The lovely Zoe, she's a sweetie. This is the house I made for her:"
480,AnimalCrossing,,My new diner&lt;3!
481,AnimalCrossing,,Before and after remodeling Chai's Tea Shop!
482,AnimalCrossing,[removed],I'm new to this
483,AnimalCrossing,I stepped away from this game for quite a while. Recently I picked it back up to check out the new content. I 100% expected to see that they had fixed the atrocious crafting system. I’m completely floored that they STILL don’t allow you to craft multiples of the same items. And from what I gather they are done updating the game.,I’m beyond blown away you still can’t craft multiple items at once (looking at you fish bait).
484,AnimalCrossing," I want to check out some HHD designs, if anyone has a code they would like to share, please do :) 

Here is mine: RA-6629-7198-5440",Happy Home Design codes
485,AnimalCrossing,?,Is it worth buying ACNL after I only played ACNH
486,AnimalCrossing,"Finally playing AC again after a long while and I swear I have the best luck. I start fresh with a new island &amp; one of my two starting NPC villagers is a new release, Tiansheng, and the other is Phoebe (who I think is absolutely amazing, I love her character design). — Anyway, I play a bit more and my first nook miles ticket takes me to SHINO??!!? What a great time to be alive.","My life, once again, belongs to Tom Nook."
487,AnimalCrossing,,"Yeah, you could say that..."
488,AnimalCrossing,"Longish question for you time travelers! 
I restarted my island from total scratch today, and realized a little later that in doing this i missed out on what was my new favorite item: The little lantern that just left the seasonal item section! 
I have never time traveled, so my question is this: would it work to time travel backwards, before my new island existed, but with my new character and all? I want to get this item, but it expired a day or two ago…
Hope that makes sense!! Thanks!!!","Question from a new, first time time-traveler!"
489,AnimalCrossing,,I FOUND FROGGY CHAAAAIR OMG
490,AnimalCrossing,"When acnh came out, my brother bought it and played it first, so he was island representative. After a few weeks, we both lost interest. Recently I’ve started playing again, and I’m wondering how I can change it so that I’m island representative and can do more. I didn’t have much progress so I could wipe the save but I don’t want him to get mad at me if he does play again",How to change island representatives?
491,AnimalCrossing,,every night
492,AnimalCrossing,,Looking to have someone be a guinea pig for my maze! It’s a work I progress but will still be difficult :)) message me!!
493,AnimalCrossing,,"Ignore my color coded missing flowers, but I’m so close to being done!"
494,AnimalCrossing,,What did KK do to deserve this?
495,AnimalCrossing,[removed],Should I restart my Island?
496,AnimalCrossing,,looking for someone to be a guinea pig for my maze! It’s a work in progress but would like to see your thought process solving it so I can fix as make it harder! Message me :)
497,AnimalCrossing,[removed],PETITION IDEA
498,AnimalCrossing,I wish I took a screenshot but if you constantly wait to drink your coffee like for it to cool down Brewster will start to ask if you want it lukewarm or hot… I thought it was a cute little touch,Something fun I learned today
499,AnimalCrossing,"So if you look at the breeding guide for it, say I got the red heart roses by first getting it from the pink and yellow flowers first and then cloning them. After that I mixed them together in a line and watered them. It gave me a black heart rose (I hope) so I isolated it. Can I clone this black heart rose to make another, and can I water those two together to get blue roses? Sorry for the weak explanation 

Here is the breeding guide https://mobile.twitter.com/austinjohnplays/status/1262851994068430849",Help with the blue rose breeding thing (I’m following austin john plays’ tutorial)
500,AnimalCrossing,,It was busy in the roost today!
501,AnimalCrossing,"I want to craft a kitchenette and and ironwood cupboard but I don’t have the recipe for an ironwood dresser, if you have a diy recipe for that I will happily work through the price for it! Lemme know :D",Anyone got an ironwood dresser diy recipe?
502,AnimalCrossing,,Looking to have someone try out this maze I’ve been working on! Its unfinished but I wanna see how you solve it so far so I can fix and make it more difficult 😈 message me!
503,AnimalCrossing,,Fashun Show
504,AnimalCrossing,[removed],LF fruit that is not peaches or cherries!
505,AnimalCrossing,,Tia &amp; Merengue working in my cafe
506,AnimalCrossing,,A beach festival with Zucker and Octavian!
507,AnimalCrossing,,Anyone want to play
508,AnimalCrossing,Can't get over how cute Tia and Merengue are as my cafe workers,Tia &amp; Merengue working in my cafe
509,AnimalCrossing,[removed],help please
510,AnimalCrossing,,Looking for ppl to visit and maybe visit me I have been playing this on and off for the past 2 years and im still new at it lol new friends needed
511,AnimalCrossing,"Unpopular opinion, does anyone agree? 

I honestly used to kind of like this game but I basically completely quit when I realized you can't interact with/ use half of the furniture you buy.. All you can do is buy clothing, pointlessly decorate your island, collect stuff to sell, donate to blather's museum and not get paid, and catch bugs. WHY CAN'T THE CREATORS ANIMATE SIMPLE THINGS? Who else wants to be able to have a bath? Or use the loft bed? Or ride on the teacup ride? 

Webkinz is a more developed game and it's sad because this has so much potential. It just kinda falls flat.",Unpopular opinion- lazy animators?
512,AnimalCrossing,,"In hindsight, I shouldn’t have hired Filbert to run my beachside café…"
513,AnimalCrossing,,I made Poppy and Maple run a bakery together and be roomies
514,AnimalCrossing,,What is the KK &amp; Brewster history? I’ve never heard of this
515,AnimalCrossing,,Decorated Chrissy and Francine Pop Star sisters room💕
516,AnimalCrossing,,Zucker and Marina in Happy Home Paradise💕
517,AnimalCrossing,,Lily is a heavy sleeper. I guess no one will get any food now.
518,AnimalCrossing,,"I'm not as talented as other people on this sub, but I wanted to show off my favorite design so far - Marshall's cafe!"
519,AnimalCrossing,,Decorated Pop star sisters Chrissy and Francine’s home🥰
520,AnimalCrossing,,Eloise’s Relaxing Reading Room 📚
521,AnimalCrossing,,Zucker and Marina finally share a home in Happy Home Paradise🥰
522,AnimalCrossing,I was at the star fragment island and got bitten by a mosquito while hitting a rock (and lost a few star fragments because of it). Learn from my mistake 😭,Pro Tip: Make sure there aren’t any mosquitoes while you’re hitting rocks
523,AnimalCrossing,,Bianca’s Winter Wonderland ☺️
524,AnimalCrossing,,"After a very long time, me and my bestie from Welcome to the City Tutu have finally been reunited through HHP :) I make sure to design her an awesome vacation home!"
525,AnimalCrossing,,Maggie’s Garden of Regeneration
526,AnimalCrossing,,Chief’s Garage space for his pals!
527,AnimalCrossing,,I beg your pardon?
528,AnimalCrossing,,Finally finished my kitchen!
529,AnimalCrossing,,Teddy's garden and villa
530,AnimalCrossing,,attack of the giants
531,AnimalCrossing,,So I went to school with Goldie--
532,AnimalCrossing,"Hi guys!

I searched for an answer to this, but I didn't find anything.  Probably because I am not really sure how to best describe it, so here goes...

I've got the Co-Op trailers all set up on Harv's Island and I have been noticing that none of the various sellers ever change their inventories.  Sahara for example is still selling the exact same rugs and mats she was listing the day she got set up!  It has been 2 weeks now and no changes.  (Been wanting to buy some more Persian Rugs, but none for sale so far and no changes being made to rugs for sale!)

Same goes for Lief and Redd.  Only time I saw any minor changes to the item lists was when I purchased an item from one of these guys, like Redd.  Is that the only way to get them to update their offerings?  What if you are not interested in anything they currently list for sale?    Redd for example, if you already have all the paintings he is selling in your Museum.  Currently the case for me.

If anyone knows what is going on here, or what I am doing wrong, please enlighten me!  I was looking forward to having a wider selection of items from each of these sellers when they had their own trailers on Harv's Island, but so far this is proving more limiting than when they just popped up on my own island.  At least then they are selling a different collection of goods each time they visit.

Thanks in advance!",Trailer Park/Harv's Island Inventories Rarely Change! ??? What am I missing?
533,AnimalCrossing,,"I LOVE wandering into the Roost, hoping to find patrons. Earlier today, not only did I find my always-hilarious Hans, I realised Daisy Mae was tucked in behind him, sans turnip hat! 🤣💖🤗"
534,AnimalCrossing,,Teddy's Garden
535,AnimalCrossing,,Anyone else have a controller with Turbo feature? You can craft one thing over and over without pressing buttons. :)
536,AnimalCrossing,,Renewed sloppy room.
537,AnimalCrossing,,Just found out that you can actually move around your island with the handheld camera 🤯 it works while swimming too.
